{
  "schema_id": "helianthus.eebus.api-surface.v1",
  "schema_version": 1,
  "fixture": {
    "synthetic": true,
    "runtime_claims": false
  },
  "packages": [
    {
      "path": "example.invalid/helianthus/synthetic/rendering",
      "name": "rendering",
      "imports": [
        {
          "qualifier": "shared",
          "path": "example.invalid/helianthus/synthetic/collision/a"
        },
        {
          "qualifier": "shared_2",
          "path": "example.invalid/helianthus/synthetic/collision/b"
        }
      ],
      "symbols": [
        {
          "kind": "func",
          "name": "Normalize",
          "type": "func(shared.Value, shared_2.Value, ...T) (T, error)",
          "signature": "func Normalize[T interface{ ~int | ~string }](shared.Value, shared_2.Value, ...T) (T, error)",
          "type_parameters": [
            {
              "name": "T",
              "constraint": "interface{ ~int | ~string }"
            }
          ]
        },
        {
          "kind": "method",
          "name": "Apply",
          "type": "func(shared.Value, ...T) (T, <-chan shared_2.Value)",
          "signature": "func (*Aggregate[T]) Apply(shared.Value, ...T) (T, <-chan shared_2.Value)",
          "receiver": {
            "base": "Aggregate",
            "pointer": true,
            "type_parameters": [
              "T"
            ]
          }
        },
        {
          "kind": "type",
          "name": "Aggregate",
          "type": "struct{ Embedded; Fixed [3][]map[string]chan<- shared.Item; Inbox <-chan shared_2.Value; Stream chan T; Callback func(shared.Value, ...T) (T, error) }",
          "signature": "type Aggregate[T interface{ ~int | ~string }] struct{ Embedded; Fixed [3][]map[string]chan<- shared.Item; Inbox <-chan shared_2.Value; Stream chan T; Callback func(shared.Value, ...T) (T, error) }",
          "type_form": "defined",
          "type_parameters": [
            {
              "name": "T",
              "constraint": "interface{ ~int | ~string }"
            }
          ]
        },
        {
          "kind": "type",
          "name": "Alias",
          "type": "*Aggregate[T]",
          "signature": "type Alias[T any] = *Aggregate[T]",
          "type_form": "alias",
          "type_parameters": [
            {
              "name": "T",
              "constraint": "any"
            }
          ]
        },
        {
          "kind": "type",
          "name": "Contract",
          "type": "interface{ Compare(shared.Value) bool; Embedded; Transform(func(T) T) (T, error) }",
          "signature": "type Contract[T any] interface{ Compare(shared.Value) bool; Embedded; Transform(func(T) T) (T, error) }",
          "type_form": "defined",
          "type_parameters": [
            {
              "name": "T",
              "constraint": "any"
            }
          ]
        },
        {
          "kind": "type",
          "name": "Embedded",
          "type": "interface{ Accept(shared_2.Value) error }",
          "signature": "type Embedded interface{ Accept(shared_2.Value) error }",
          "type_form": "defined",
          "type_parameters": []
        }
      ]
    }
  ]
}
